{"base_timeframe":"1m","causation_id":"evt_a42f53cee3cc581dc0bddbb536fbc3f444f6e1a4693e5e8c559473df33499a69","correlation_id":"corr_xau_20260716_1001","created_at":"2026-07-16T01:02:10Z","entry_candidate":2416.5,"expires_at":"2026-07-16T01:10:00Z","hpa":["M5_DISCOUNT","M15_DISCOUNT","M30_MIDDLE"],"hypothesis":"LONG","instrument":{"point_size":0.01,"symbol":"XAUUSD","venue":"ICMARKETS"},"momentum":{"15m":{"classification":"RANGE_DRIFT","direction":"NEUTRAL","source":"FIXTURE"},"1m":{"classification":"CLEAN_PUSH","direction":"LONG","source":"FIXTURE"},"30m":{"classification":"RANGE_DRIFT","direction":"NEUTRAL","source":"FIXTURE"},"5m":{"classification":"CLEAN_PUSH","direction":"LONG","source":"FIXTURE"},"5s":{"classification":"UNAVAILABLE","direction":null,"source":"FIXTURE"}},"path":"SNR_REJECTION","provenance":{"capture_mode":"FIXTURE","compiler":"project-a-session-3","compiler_version":"1.1.0","port":4999,"symbol_verified":true,"timeframe_verified":true},"request_id":"req_bbbc4181c7673951b0e978742b1d81f18147d5b3","risk":{"execution_environment":"MT5_DEMO","live_execution":false,"max_spread_points":10,"mode":"SHADOW","rr":1},"schema_version":"1.0","screenshots_required":["5s:sha256:431ced6916a2a21a156e38701afe55bbd7f88969fbbfc56d7fe099d47f265460","1m:sha256:431ced6916a2a21a156e38701afe55bbd7f88969fbbfc56d7fe099d47f265460","5m:sha256:431ced6916a2a21a156e38701afe55bbd7f88969fbbfc56d7fe099d47f265460","15m:sha256:431ced6916a2a21a156e38701afe55bbd7f88969fbbfc56d7fe099d47f265460","30m:sha256:431ced6916a2a21a156e38701afe55bbd7f88969fbbfc56d7fe099d47f265460"],"session":"ASIAN","setup_id":"setup_10389478bde01fe59035f0ab63e6f273","sl_candidate":2414.5,"snr":{"high":2416,"low":2415,"type":"CLASSIC"},"source_event_ids":["evt_a42f53cee3cc581dc0bddbb536fbc3f444f6e1a4693e5e8c559473df33499a69"],"spread_points":8,"tp_candidate":2418.5,"trigger_price":2416.5}
