{"base_timeframe":"1m","causation_id":"evt_xau_20260716_0001","correlation_id":"corr_xau_20260716_0001","created_at":"2026-07-16T00:01:10Z","entry_candidate":2416.5,"expires_at":"2026-07-16T00:10:00Z","hpa":["M15_DISCOUNT","M5_DISCOUNT"],"hypothesis":"LONG","instrument":{"point_size":0.01,"symbol":"XAUUSD","venue":"ICMARKETS"},"momentum":{"15m":{"classification":"WEAK_PUSH","direction":"SHORT","source":"FIXTURE"},"1m":{"classification":"EXHAUSTING","direction":"SHORT","source":"FIXTURE"},"30m":{"classification":"RANGE_DRIFT","direction":"NEUTRAL","source":"FIXTURE"},"5m":{"classification":"WEAK_PUSH","direction":"SHORT","source":"FIXTURE"},"5s":{"classification":"UNAVAILABLE","direction":null,"source":"FIXTURE"}},"path":"SNR_REJECTION","provenance":{"capture_mode":"FIXTURE","compiler":"project-a-session-3","compiler_version":"1.0.0","port":4999,"symbol_verified":true,"timeframe_verified":true},"request_id":"req_e35ada7686891f17f11260dcef5682f769dd3698","risk":{"execution_environment":"MT5_DEMO","live_execution":false,"max_spread_points":10,"mode":"SHADOW","rr":1.0},"schema_version":"1.0","screenshots_required":["5s:sha256:431ced6916a2a21a156e38701afe55bbd7f88969fbbfc56d7fe099d47f265460","1m:sha256:431ced6916a2a21a156e38701afe55bbd7f88969fbbfc56d7fe099d47f265460","5m:sha256:431ced6916a2a21a156e38701afe55bbd7f88969fbbfc56d7fe099d47f265460","15m:sha256:431ced6916a2a21a156e38701afe55bbd7f88969fbbfc56d7fe099d47f265460","30m:sha256:431ced6916a2a21a156e38701afe55bbd7f88969fbbfc56d7fe099d47f265460"],"session":"ASIAN","setup_id":"setup_xau_20260716_0001","sl_candidate":2414.5,"snr":{"high":2416.0,"low":2415.0,"type":"CLASSIC"},"source_event_ids":["evt_xau_20260716_0001"],"spread_points":8,"tp_candidate":2418.5,"trigger_price":2416.5}
